{
  "$schema": "https://json-schema.org/draft/2020-12/schema",
  "$id": "https://governseed.example/schemas/external-oss-effectiveness-r2-contract.schema.json",
  "title": "GovernSeed external OSS effectiveness R2 contract",
  "type": "object",
  "additionalProperties": false,
  "required": ["schemaVersion", "experimentId", "revision", "status", "supersession", "authority", "taskSets", "arms", "randomization", "runtime", "budgets", "analysis", "scoring", "evidence", "owners", "gates", "claimBoundary"],
  "properties": {
    "schemaVersion": {"const": 1},
    "experimentId": {"const": "GS-OSS-2026-08-05-EFFECT-R2"},
    "revision": {"const": 2},
    "status": {"const": "IMPLEMENTED_PENDING_REVIEW_AND_FORMAL_LOCK"},
    "supersession": {"type": "object"},
    "authority": {"type": "object"},
    "taskSets": {"type": "object"},
    "arms": {"type": "object"},
    "randomization": {"type": "object"},
    "runtime": {"type": "object"},
    "budgets": {"type": "object"},
    "analysis": {"type": "object"},
    "scoring": {"type": "object"},
    "evidence": {"type": "object"},
    "owners": {"type": "object"},
    "gates": {"type": "object"},
    "claimBoundary": {"type": "string"}
  }
}
