{
  "schemaVersion": 1,
  "experimentId": "GS-OSS-2026-08-05-EFFECT-R2",
  "revision": 2,
  "status": "IMPLEMENTED_PENDING_REVIEW_AND_FORMAL_LOCK",
  "supersession": {
    "supersedesBeforeExecution": "GS-OSS-2026-08-05-EFFECT-R1",
    "r1Executed": false,
    "poolEvidenceAcrossRevisions": false
  },
  "authority": {
    "repository": "Eskasia/governseed",
    "decisionMainSha": "12f1802173c05e880139a2841900e6953d16d42d",
    "decisionMainTreeSha": "2eee3c5237d3ef7cda947e3cb843eddd50668f69",
    "contractDecisionComment": {"id": 5185865928, "bodySha256": "12263c44592a5e7a038e51ede76beeccc637ea4904681b3a03817a66b386a3f5"},
    "identityResolutionComment": {"id": 5186392861, "bodySha256": "e8ceeb21c85538a8f279db2626f66bed541cfe8476afbcf4604507f4ebff4191"},
    "canonicalPath": "benchmarks/external-oss-effectiveness-r2/"
  },
  "taskSets": {
    "pilot": {
      "pairedRepetitionsPerTask": 3,
      "pairedAttempts": 9,
      "armExecutions": 18,
      "tasks": [
        {"taskId": "TASK-OSS-01", "repository": "immich-app/immich", "identitySource": "V5_RECONSTRUCTED", "sealedSeedCommit": "15ba6bed78feebe392dfbe13cf0be4065b260af7", "sealedSeedTreeSha256": "3ebafacc713e37ea6939f08b1205198b415c5ae62dcbddb9f11ce4ab732ee70e", "taskBriefSha256": "9e5914971d085ac857ddf63055be06f224379ad6b32dde7991f01380818e33f7", "hiddenOracleSha256": "bc20c7b7821138e733a2aadbaf48397b0e3840c6cdb3c27bb8ae8a4c963ee6c3"},
        {"taskId": "TASK-OSS-03", "repository": "louislam/uptime-kuma", "identitySource": "V4_PRESERVED", "sealedSeedCommit": "2ccc49b77ba0c0e9dc159fcce5516efa7c0e7a18", "sealedSeedTreeSha256": "5fdbf067da484e3778a1345297a33d984779be73c020ded93198a1c84f5a07ca", "taskBriefSha256": "58fec842805c88a130003f8468762131dd9ebfb8d1205c96008a94e3273c73c3", "hiddenOracleSha256": "bd05a49e86e5f268a7adc62c5defe2addc51032ad7f8b6e6461777c078e74cc6"},
        {"taskId": "TASK-OSS-09", "repository": "paperless-ngx/paperless-ngx", "identitySource": "V4_PRESERVED", "sealedSeedCommit": "5f5ab1beea4feaaecee7131b4b36185f09e2f53c", "sealedSeedTreeSha256": "64d046e9abad54f4f10d2e489d4385e5ca6df1e0d5b8d67ecf48ad560bf4ad42", "taskBriefSha256": "59c0898106338adce0c2489e1213ba67e7c0549a90f4c8208ab581c54046e719", "hiddenOracleSha256": "34c3f64aebd45be29fd0b1033e3649025a2c93b2c153178ecb124c086d368f2c"}
      ]
    },
    "confirmatory": {
      "pairedRepetitionsPerTask": 3,
      "pairedAttempts": 24,
      "armExecutions": 48,
      "disjointFromPilot": true,
      "identityStatus": "PREPARED_PENDING_REVIEW_AND_FORMAL_LOCK",
      "tasks": [
        {"taskId": "TASK-OSS-11", "repository": "fastapi/fastapi", "identitySource": "R2_PREPARED", "sealedSeedCommit": "98b12fe56f97107e71a20fc1cf334ccfa590efb5", "sealedSeedGitTree": "70107d58f66273de0012e7b7e0b30c954bf87dff", "sealedSeedTreeSha256": "4a0aa2b3efcab50232200f20c0f10c6c755945df129dfa11d0e23d274b60a35c", "taskBriefSha256": "757f3ec7c85e65f5d762f4a9bf6b45fc96fba6f9a138007a4a2298ba0a58b0a0", "publicTestSha256": "b10523e858fb014e140d50fec82e41924bc5565a0ccaf2dce9b3d0e58b426df3", "hiddenOracleSha256": "9d72fc8a26cc0ed005a612f355b76d85605d11ef846b187773e4d61de91eee71", "pathPolicySha256": "7884a28b0a6879108d8d7c2ba4df81593eb7494d128c5d721829929e395b239a", "taskPackagePath": "benchmarks/external-oss-effectiveness-r2/tasks/TASK-OSS-11/task-package.json", "taskPackageSha256": "f728cd1903fc7d18f9949a6acd41bb4d7e07b30a739f19d9ea4e571a279d08d0", "parentRedFixGreen": true},
        {"taskId": "TASK-OSS-12", "repository": "django/django", "identitySource": "R2_PREPARED", "sealedSeedCommit": "1c5927f04a853c79ac9b098eab92fb328ff9e4ad", "sealedSeedGitTree": "7250a1d7281e42e94b9594019d06624059530b52", "sealedSeedTreeSha256": "966cec8e3a74ed326dd98294ceb48998a7ee34f5589b891ac816fa8f1ed0ccef", "taskBriefSha256": "472957bd1e6f1f744922a0bc3e9b69be8fe62be1978764f81e00dc18a2cb53e4", "publicTestSha256": "75eefa2fe43523a61c100ec58d7a25a166db3bc2b42af6b7291de9471e6a866a", "hiddenOracleSha256": "91350c45e49b511276361d796f7649820f0af1a3405429c330fcb645a9eed553", "pathPolicySha256": "f18a1f9b8830df7a6a860c3e84dc8b46c191c0c5dfd34e558c0fee2b00540443", "taskPackagePath": "benchmarks/external-oss-effectiveness-r2/tasks/TASK-OSS-12/task-package.json", "taskPackageSha256": "7eae3d7bd17f1a2624bca326d32cc7bc6adaa8521a4d149581825e9717620ed2", "parentRedFixGreen": true},
        {"taskId": "TASK-OSS-13", "repository": "vitejs/vite", "identitySource": "R2_PREPARED", "sealedSeedCommit": "1331b0b438b1e7193effb7d2341660bccb9c3155", "sealedSeedGitTree": "e94e68902fd6c7db705af5c52c508c452ea9dca6", "sealedSeedTreeSha256": "e295934d2f20bd34dcc6edeb81e2dc2799b061345e2d3c9289536deb24aad104", "taskBriefSha256": "83635829c388f80341dfd2250871b75bae4e35e2870a1d22c12178497da0d2f7", "publicTestSha256": "fd5d4b9e358c75197a5bd8564de7c94067eeab138f231c07fd3d8664a584033f", "hiddenOracleSha256": "422ea10fd78ddb0141014002574a1af87995bea76e9e7c0d552f599e48a77a11", "pathPolicySha256": "8674c255d344b3008ffde9cd7e4a92184dde5d5440562d5b5564fe408d00df92", "taskPackagePath": "benchmarks/external-oss-effectiveness-r2/tasks/TASK-OSS-13/task-package.json", "taskPackageSha256": "d5f3c91f187b65c19716dcb2b625f6abfcbe71daaa1083c1e12f1a427b26e245", "parentRedFixGreen": true},
        {"taskId": "TASK-OSS-14", "repository": "eslint/eslint", "identitySource": "R2_PREPARED", "sealedSeedCommit": "4d7db6628e2badf0857cb88734fe641c3874bce9", "sealedSeedGitTree": "981a328725e6800d17abdd9549ed60e7c27fb08c", "sealedSeedTreeSha256": "a2f0d3670c0e5ba3e7a0ffaf6bda87cb179a1bf4a7c930a2c2a25fd2b54cf28a", "taskBriefSha256": "dce9f59ee7b0cf46fd6da0fe1de538cad92e9d5d6cfe2e40fee2d5bbb4137e71", "publicTestSha256": "7bf2d3589c849366deefd93455ed7f4bfaa213d9895e4e5fce5db8f656ea7bae", "hiddenOracleSha256": "9b3dca5a9fe50ae05423ecb5b5c37b748e511cd784a2dca421bceadb1b616fd5", "pathPolicySha256": "fa64acca3c95e7d962f0157902b5d75be566809735e882d2373960d1c45f888f", "taskPackagePath": "benchmarks/external-oss-effectiveness-r2/tasks/TASK-OSS-14/task-package.json", "taskPackageSha256": "aee6fe56727956efddc310b647c04a9d77bb13c5ae2e2312b07cacd8aff51e47", "parentRedFixGreen": true},
        {"taskId": "TASK-OSS-15", "repository": "pydantic/pydantic", "identitySource": "R2_PREPARED", "sealedSeedCommit": "a54529f06204ecb8f940d2506ff66dd1521917c8", "sealedSeedGitTree": "81d28be88d901230b941af26ff2cc3ab9351caae", "sealedSeedTreeSha256": "9139439119f95eab3c96dfdedab19018d343e44d86f3ddba7f2c6903007c37d2", "taskBriefSha256": "a77d579b92e81a7f7175ae0a8071a730f87a896fdead5feda5826d6e21131e56", "publicTestSha256": "6d5a4afb72c456195f9bc421974b11e8e8961244a9991851cb65099983a7dd73", "hiddenOracleSha256": "6f777a0985ba6c003fa53b2882924cc5b7d7783f352e907ee90ce3b6361ba7f3", "pathPolicySha256": "d2b4bc6894c5789e868d3481176f5e145e1adda39bce875ac14fa736fe4a8da1", "taskPackagePath": "benchmarks/external-oss-effectiveness-r2/tasks/TASK-OSS-15/task-package.json", "taskPackageSha256": "0e6d218274495a8de22ecad9d221655022046313063d3b73060e2d67d63e6e07", "parentRedFixGreen": true},
        {"taskId": "TASK-OSS-16", "repository": "pytest-dev/pytest", "identitySource": "R2_PREPARED", "sealedSeedCommit": "1d5c40392ea42db38582b096f639eb762a5527c8", "sealedSeedGitTree": "ceac32e713e52dd91f3133009aea77dbc667a00a", "sealedSeedTreeSha256": "d664359f97c3fb5d1511711150d7f7dd4884f18e62ba5ab1230fa6da22708081", "taskBriefSha256": "080c092ca451e3bc568a88c9ecdd0195b3d5fdf8d38dfda743eb2907617476f6", "publicTestSha256": "5a6fa593f1ada9086facf09da1e5bb5c657d187abe476f7e549c4c022c8ef31e", "hiddenOracleSha256": "5e65e417bfb190cf1eeb66b41a6a921cc5ef2e897585a83c3434c3af744c4e1f", "pathPolicySha256": "b76cb10b2454b56a9ed560fdd56fb85c3f173ef207ccb98772777d76fbe6895d", "taskPackagePath": "benchmarks/external-oss-effectiveness-r2/tasks/TASK-OSS-16/task-package.json", "taskPackageSha256": "5c29c8a2807b3fd0083456d43e2378ecd41739a7a0ce1528744471a26f9f7df7", "parentRedFixGreen": true},
        {"taskId": "TASK-OSS-17", "repository": "encode/httpx", "identitySource": "R2_PREPARED", "sealedSeedCommit": "90538a3b4610ba49ce16c997bcfdb9101f9503be", "sealedSeedGitTree": "ad8e8f071d5522b24c5926bfd4c637fb78b0d28d", "sealedSeedTreeSha256": "bfc514fd363319e1442425f3eb35307fff0331dab4ced5645e2866d12117ba75", "taskBriefSha256": "ef716c25eb7953b3e04d806553c778973b216c62414225db80bc01e6188664b9", "publicTestSha256": "9f56a1e11df9062c7f0db4d4c9ff3155a5bd2d836751cb52019b07752636e576", "hiddenOracleSha256": "0288919cd6481ca4fe835a31018dad34ccb9b9cebc1c7d1651f45fcfdbbbec01", "pathPolicySha256": "d0e51b40b290de97965dbe3b5338d603000f8432867fef603557b97080d8c988", "taskPackagePath": "benchmarks/external-oss-effectiveness-r2/tasks/TASK-OSS-17/task-package.json", "taskPackageSha256": "609eff4c1cac6647f8f1beea041d6747f0b9da70cf57761fc526b050d4a84cba", "parentRedFixGreen": true},
        {"taskId": "TASK-OSS-18", "repository": "pallets/flask", "identitySource": "R2_PREPARED", "sealedSeedCommit": "06ea505ce2b2042af26e96d35ebf159af7c0869d", "sealedSeedGitTree": "2af33b2da3792f1cd83b9fa35e06f4ba97dbe78c", "sealedSeedTreeSha256": "79cf5298a994eba7c356f5904d159e7767eabe61b9397dbbbe6d02c1087926c6", "taskBriefSha256": "6e469e7014163e23c1d483135febe4708b7d09aff539c0f6fe624f79646b32f1", "publicTestSha256": "967e79c49bffe04ef133db157cac59a426b0f81a84cc7122b6092f3c526732b7", "hiddenOracleSha256": "282ddf1d3f0e5d023891b175ad0f902240f5062645b63c8151f0816329c2923a", "pathPolicySha256": "48659f343624e5870fe488d1292ac7b3b5d4199dff0f004ad25a023733a33909", "taskPackagePath": "benchmarks/external-oss-effectiveness-r2/tasks/TASK-OSS-18/task-package.json", "taskPackageSha256": "8708c3f90d33fb815906536f5be333c1105cc5d46d82e8dea85a43e22f1ea7e5", "parentRedFixGreen": true}
      ],
      "requiredBeforeFormalLock": ["sealed seed identity", "task brief hash", "public test identity", "hidden oracle hash", "parent-red/fix-green evidence", "allowed and forbidden paths"]
    }
  },
  "arms": {